<!ELEMENT bookstore (book+)>
<!ELEMENT book (title, author, price, stock)>
<!ELEMENT title (#PCDATA)>
<!ELEMENT author (#PCDATA)>
<!ELEMENT price (#PCDATA)>
<!ELEMENT stock (#PCDATA)>